place,country,continent,cleaned_text,count_label,tfidf_label,w2v_label,x,y,dbscan_label,h_label
Waikiki,USA,America,swamp mile downtown island city canal site day commercialism money point thing kalakaua avenue place beach strip sand place surf lesson outrigger canoe ride pedestrian walkway edge garden refuge frenzy centre spot,0,9,1,-0.1952335640527871,-0.0025649811114339207,0,1
The Florida Keys,USA,America,folklore film hearsay key mile chain island mile image intrigue day cocaine cowboy beach view sunset west usathe lover paradise fishing snorkelling diving area reef band coral mile coast key stop west self conch republic style street plenty bar hour sunset cuisine part shack food atmosphere conch mollusc speciality chowder fritter lime concoction lime milk resemblance imposter py rest mainland west culture rest attitude lifestyle islander expanse tourist year place spirit attitude influx population bahamian village thoma petronium street cuban african bahamian corner town patchwork storey cigar maker cottage grocery church foliage,0,9,6,0.19395366208510842,-0.0003758576058913706,0,5
Yellowstone National Park,USA,America,park yellowstone national park visitor year percent summer reason diversity offer mind mountain scenery colour grand canyon azure lake flower meadow wildlife safarus park bear herd bison buffalo marmot prairie dog eagle coyote dozen wolf pack prowl world volcano activity world geyser thousand fumarole plume steam pot mud clay course spring park volcano caldera mile year,0,1,9,0.05979657335898834,0.007529579277882069,0,9
The Big Island,USA,America,island island room population town person captain cook visitation share restaurant bar facility community town century resort lava flow coast sunshine thank volcano road town beach sand island shore volcano national park mauna mauna north crater cinder cone rainforest time foot eruption birthplace king island temple site puuhonua honaunau southwest waipio valley northeast island volcano mauna hawaius volcano national park mile park landscape desert tundra rainforest volcano evidence power volcano whim lava flow town property hundred yard focu park caldera summit crater mile ocean visitor centre jaggar museum geology orientation home volcano goddes spot island island mark twain lake fire explosion expanse steam vent activity caldera visitor plume smoke distance mile trail crater cairn cairn landscape lava mile devastation trail boardwalk scene eruption chain crater road crater drive cone vent landscape tree trunk shrub sheet lava slope road coast mile trip park entrance facility activity time lava road rock earth,0,7,0,-0.07563578363737673,0.006371527542666678,0,15
The Great Plains,USA,America,hill grassland great home adventurer artist outlaw century sioux warrior crazy horse sitting bull jesse jame mark twain south dakotum north dakotum great expanse corn field flyover state value contrary region attraction route scene loui canyon forest hill splash colmy nation river history home tribe sioux handful trader region colonization civil destruction settler herd bison eradication indian ancestor presence south dakotum latter tribe east condition series drought emigrant region world wheat production boom great drought dust storm year image fantasy tornado land drama form weather freak blizzard dust devil lightning storm twister tornado today farming activity game town region economy thank north dakotum landscape south dakotum mount rushmore black hill region area plenty entertainment city barbecue birthplace mark twain cowboy town south dakotum dodge city great distance road population,0,8,2,0.2654957152248405,-0.0002891119389265531,0,10
The Rockies,USA,America,rocky mountain state size american west home mile forest border desert mexico spine array landscape geyser basin lava flow valley sand dune region snow peak grandeur wildlife bison bear moose legacy miner cowboy outlaw native american area resource century state character peak leader region reputation metropoli city part gateway resort country tourist circu manuscript stream lake community stretch scrubland country state grand teton national park bighorn mountain whitewater rafting rocky mountain wilderness range park town delight switchback road mountain pass continental divide point transport area bike cycling terrain continent course mountain hike june september temperature sixty degree fahrenheit desert plain mountain variation mountain course altitude period acclimatization elevation fact part hour sunshine year diego miami beach spring snow time gold aspen tree mountainside autumn october thing hiking sport run november march june snow condition month january temperature,0,1,3,0.11277885882314363,0.006176269622142799,0,0
Santa Fe,USA,America,city santum adventurer missionary decade pilgrim plymouth rock plateau foot sangre cristo mountain mexico capital adobe house church architect museum gallery lover world season summer temperature eighty fahrenheit winter daytime high snow mountain city half tourist town inhabitant santum summer crowd downtown area ambience country town array treasure insistence building century palace else city bearing place sense history culture palace governor mexico museum art downtown museum indian art culture folk couple mile santum neighbourhood barrio analco downtown home miguel mission canyon road art district guadalupe street west development,0,2,8,-0.41030214994686764,-0.009550781467914821,-1,6
The Capital Region,USA,America,city district columbium state west capital region day colony history landing agitation independence battle war civil right milestone protest movement issue abortion right century settlement root estuary chesapeake colonist gold fortune tobacco settlement half person slave work weed tobacco position east coast region mason dixon line line border dispute boundary state slave civil country slave market block white house tension civil trace mile capital battleground year monument museum stop tmy region country south home hundred site estate leader politician capital height shenandoah national park crest blue ridge mountain expanse wildernes whitewater river backwood village west tourist tradition chesapeake village weekend pleasure boater character state capital bridge ferry eastern shore castle border town east coast beach,0,8,7,-0.08538707385169104,0.0006793570177773806,0,15
Monument Valley,USA,America,landscape sandstone butte pinnacle rock expanse sand wild image monument valley utah state line mile perception spot scenery course moviemaker day majesty place breath fact stronghold culture monument valley highlight trip pair monolith east thumb bulk dozen spire rock panel ruin butte mile detmy monument valley tribal park view road visitor centre view hotel monument valley mile self drive route ride vehicle hmy navajo jeep horseback tour backcountry minute jeep trip person spot plenty alternative movie location totem pole tour hogan dwelling weaver work,0,1,0,-0.04849721270238199,0.00607348381103601,0,3
Zion National Park,USA,America,cliff forest waterfall zion national park park section canyon mile mile vega kolob canyon centrepiece park oasi canyon desolation weirdnes canyon gorge sound water summer traffic tourist visitor canyon detmy interstate vega salt lake city canyon scenic drive time hiking trail crowd hike verdure valley desert tableland summer season temperature exces thunderstorm august spring flower autumn colour river,0,1,7,-0.12460020183472752,0.009684823977625769,0,4
Mexico City,Mexico,America,world mega city person mountain bowl level district city city relic culture pyramid dropdown content site dropdown content travel guide culture city period disease building city area dictator porfirio building programme growth revolution resident time century population revolution thousand work city population shantytown expansion transport system construction system growth today limit distrito federal spread world city list problem vulnerability earthquake person city building collection work site mariachi band attention market octane capital colmy charm country town dynamism museum mural market core cluster district neighbourhood place market site victim stake parkland century clutch museum museo tequila mezcal story liquor museo mural artist tarde dominical monumento suburb zona rosa street city area hundred bar restaurant hotel shop number tourist cros section class village zona rosa district suburb city artist fringe rent housing proximity city centre time gallery bar area eating city pavement style restaurant club nightlife act stage place midnight music flight island talent bar dirt cheap cantina lounge hotel bar country cantina male preserve zona rosa pink zone zone section slew bar hangover time practice street trade extent city block stationery area shoe shop other instrument craft need place origin shop resort item country bargain hunter mercado market place merced market section travel guide activity capital local sport capital place football match game league city seater aztec stadium capacity game sunday afternoon january june august november part fiestum thing teaser country event programme capital extreme wealth poverty disparity theft precaution city valuable credit debit card hotel wad money camera valuable market area night barrio area lagunilla market centre street drug trade crime mugging danger abduction ransom market mansion shop flower patio place place restaurant crowd page affiliate link recommendation image palacio bella arte palace fine art theater museum music venue shutterstocksoccer wrestling event bullfight machismo layer symbolism interpretation battle animal cruelty spectacle animal death part experience sport clas barrier sunday afternoon winter season woman walk society stadium sombra shade seat mass terrace hour bull ranch matador bull matador performer fight act third trumpet blast cape bull preparation picadore mount horse lance bull shoulder blade torero number matador metal spike bandillera bull manner mean bull matador bull move crowd bravery finesse matador spirit bull shout stadium pas matador bull hoove sword shoulder blade bull sand bull performance matador praise kill matador bull ears time season tail bull stud cause celebration spectacle expansion year west suburb town charm reason ruin rival height city country fall rise time city temple shrine excellence pottery trade mixtec attempt ally march chieftain temple church place spaniard church year church figure claim chapel church village population nuestra remedio hill background snack chapuline grasshopper hill fact remain great pyramid tepanapa pyramid pyramid side site shell series pyramid site pyramid entrance series tunnel archeologist ruin deal site valley ring structure patio altare look mural site museum replica section public fraction tunnel pyramid person sense adventure side tunnel element temple stairway gloom tunnel area excavation part pyramid shrine explanation importance capital extreme wealth poverty valet suv space pavement vendor beggar disparity theft precaution city need valuable credit debit card hotel hotel mugger card hold cash wad money camera valuable market area night barrio station name street doctor area lagunilla market centre street drug trade crime mugging danger abduction ransom taxi reputation driver report person taxi hotel street registration numberplate side vehicle libre driver identification taxi rank sitio taxi rank number driver taxi airport terminal one tourist spot township city place capital lakeshore kingdom aztec century siege city construction capital nueva focu area plaza central visit reach suburb sight leon museum museo minute walk centre blue house family home life husband house nation death tenure host leon wife assassin concern ease acces property gesture house centre capital life coterie artist intellectual house lawrence visitor sympathy room gallery example work portrait work viva vida life watermelon pain trauma amputation toll control spirit charcoal self portrait marxismo salud enfermo marxism health room signature tehuana dress painting dozen paisaje quebrada rock face face purple work section house style kitchen mug wall decoration animal figure collection retablo stairway studio wheelchair easel course mirror influence house interest culture artefact house collection courtyard step pyramid house museo casa geniu russian revolution organizer army block memorial world death exile death number country asylum refuge time trotskyite president behalf assassination house steel gate shutter wall watchtower today building home suburb place book shelve glass desk trapping life bullet hole artist husband woman history honesty cruelty theme woman julie taymor biopic salma hayek role icon work insecurity relation family country politic subject painting career collection work museo dolore olmedo daughter mother father blue house museo bout polio year school year senior mural friend child year role woman career medicine accident tram fracture pelvi steel handrail month paintbrush life accident life recovery bunch artist free thinker communist year woman frog face reputation womanizing affair sister affair woman death part life love painting career half canvase self portrait symbolism theme abortion bone love body juxtaposition element henry ford hospital depiction grief body wasteland foetu bone implement circle friend affair communist julio antonio mella muralist david siqueiro attempt house life event autoretrato pelo cortado self portrait hair trademark tress tehuana dress suit hair year independence relationship injury accident life condition solace work drink drug columna rotum column spine column succes exhibition work lifetime year year wheelchair activism advice part demonstration intervention pneumonium july stage work word vida attempt life house scar plaster bedroom wall group painter david siqueiro commander civil order mexican communist party guard shot house wife bed house assassin household businessman cause arrival house afternoon august article study moment pick killer coat skull hour hospital operation life killer frank jackson year jail action identity jaime mercader spring climate place escape state capital street centre traffic fume garden villa district centre narco baron rivalry spate violence spring year discotheque corpse bridge deputy kingpin succession wake assassination marine conflict person situation aztec city place wood resort hunting ground ruler spaniard name horn city siege palace palace building trend century emperor shah house suburb mansion mexican expat popularity year lucha wrestling spectator sport dozen venue capital host fight night week public magazine comic photonovel film life ring hero villain telecast thing past wrestling move combatant ring time bout action maintenance stage persona hero villain mask rudo force tactic opposition guile lack brawn battle screen antic suspension disbelief feature wrestling emergence wrestler figure costume struggle tenant association rent housing earthquake part opposition government official ring sort cheerleader opposition rally wrestler time doubt santo saint movie title santo vampire woman lead mask retirement identity reputation gentleman ring death funeral history president fight tuesday arena coliseo peru friday arena lucio lavistum colonium block baldera area night ticket door paseo street building emperor city boulevard capital drive palace centre impetu direction metropoli length avenue bosque junction walk bus pesero direction stretch norte extension traffic term disparagement lane traffic line tree statue intersection style century house year heart city building tower steel glas pulse shop avenue airline office rental agency bank pleasure stroll city republic city minute trip couple hour view height cuisine concentration sight cathedral convent museum mansion country place city centre cerro sight area city couple day trot defeat part history city american french victory country history battle force mexican army time size french prince emperor troop fort cerro fuerte loreto fuerte base dent plan cinco mayo fiestum holiday country kilometre pine hill real monte mineral monte silver mining town retreat place street mining relic hill town architecture twist iron roofing existence style cottage roofline football century miner real monte state descendant cornishman football club football league year football league ladder system division table team season placing league champion table table team table play league championship season year june season season winner year champion champion relegation division season los average fact league season relegation disaster example team primera name regulation regulation team clash interest suspicion corruption match music dancing course mexican wave carnival atmosphere spectator face paint family affair salesperson drink beer type food price seat stadium sitting room accident club cruz azul university side game crowd club spectator game distance club game fan reason club support fan atmosphere self family occasion risk referee pitch riot polouse game country football time politic government football squad exhibition match side estadio azteca firm silver mine real monte century mining expertise british miner pit successor firm miner legacy real monte form pasty introduction soccer time soil real monte plaque park spot game community football club football league silver supply metal basi town fame livelihood form jewellery hundred workshop array shop tourist city place version village mas terracottum house alley interval pattern mansion courtyard flower tower church spire santum prisca wedding cake church centre town place development occasion town spaniard rumour mineral wealth expedition succes century immigrant ignacio vein lifetime church santum prisca building lifestyle death boom silver trade revival arrival architect writer william spratling jewellery workshop skill design completion road time influx tourist town expense charm capital island middle lake causeway stone city resident aztec lake year community legend patron city eagle nopal cactu snake legend basi nopal eagle snake motif centrepiece flag lake site fish aztec garden reed crop lake result self food lake city causeway bridge attack noche island city area kilometre lake base aztec programme expansion valley series alliance treachery period year empire tribute part country city bernal account construction discovery remain templo mayor remain light city defeat memory native woman interpreter person tribute successor resistance mural visitor stage pyramid stream tour bus car ruin sunday site exploration cool morning crowd ruin city scale pyramid refurbishment hill look height city population estimate area kilometre kilometre centre building hulk mural entrance puertum calzada muerto causeway dead axi city roadway building building length impact pyramid temple street rest city angle juan symmetry bridge width name series plaza staircase street aztec building earth mound burial place king function significance design reconstruction storey platform panel wall case edificio superpuesto building hand side river structure level living quarters priest entrance puertum ciudadela square platform altar centre city heart house priest noble meeting place space pyramid construction excavation temple back pyramid phase temple structure pyramid section site step relief interval head serpent rain trace paint place pyramid landmark structure building size ruin base size pyramid cheop side nature view bulk accuracy alignment day year july pyramid noon facade point day alignment point line calzada muerto city fact tonne stone earth construction benefit wheel beast burden metal tool pyramid leopoldo batre fashion dynamite structure face surface search building fact stage city development temple heart pyramid staircase right calzada muerto esplanade ruin temple priest dwelling structure layer wall terrace area sanctuary evidence structure archeologist tunnel public clover leaf cave centre pyramid kind sanctuary holy reason foundation basi influence theory nature legend aztec cave spring rain bringer fertility sort fountain life grotto symbol creation people site oracle cult sacrifice time skin victim xipe totec cave pyramid calzada muerto luna pyramid moon structure tzacualli phase thank ground level structure level stairway reason building scale result approach plaza luna pyramid overview site layout length thoroughfare sunset closing time guard palacio palace quetzal butterfly plaza luna temple example building view elite room patio pillar palace name design bird quetzal owl butterfly gallery patio fresco building decoration restoration building palace remain palacio jaguare jaguar headdress conch shell curl music speech prayer mural templo caracole emplumado temple plumed snail shell motif feather seashell parrot mural trace temple calzada muerto pyramid priest quarters fresco apartment building paradise mural museo nacional quarter city road back part other complex procession priest ball game vitality strip quality speech bubble figure mouth theme intent west site time museo sitio sculpture garden room artefact site feature item interior site city tool ceramic polychrome vessel animal plant design series brazier censer flower butterfly shield window wall room glas floor relief model city glas floor room burial temple statue god bottom feature trio brazier rise fall evidence community vicinity township site period patlachique phase population city characteristic pyramid moon calzada muerto development tzacualli phase construction blossoming expression tlamimilolpa phase evidence city influence architecture sculpture pottery site xolalpan phase peak population power building addition structure period sign decline phase century city result invasion strife reason forest city column roof support door lintel quantity wood lime plaster building result soil erosion hillside today addition effort person form fertilizer knowledge crop rotation land ability cause city ruination time aztec place name place god mythology record city evidence name struggle aztec independence capital state name byword treachery alliance town fate aztec disappearance culture spaniard town glory reputation isolation development town middle plain mountain town interest cluster bank post office bandstand terracottum ochre tone building city ciudad roja capital state toluca lerdo today centre plain altitude city country mountain scenery nevado place friday site market country city centre plaza block side nation series arcade portale shop restaurant portal madero south portal noviembre east portal west side century cathedral east mustard church santum cruz sight north portale cathedral plaza plaza north cathedral north side palacio gobierno east plaza garibay shrubbery fountain city edge valley centre fortres century cathedral monastery pyramid site town centre part site interest city area dig hole ground archeologist centre significance site information museum entrance fragment atlas chac mool basalt head bit sculpture frieze site centrepiece pyramid templo tlahuizcalpantecuhtli temple morning star pyramid atlas basalt figure roof sanctuary guise morning star warrior figure loincloth sandal helmet sport ornament neck leg protection shield back chest piece form butterfly atlatl spear thrower hand arrow javelin left pillar warrior god relief theme temple stone remnant jaguar eagle symbol warrior group heart front temple colonnade pillar roof priest noble troop part ceremoney shade part bench relief decoration procession warrior priest bench palacio quemado burnt palace fire temple side room square patio light paint chac mool square city front south temple palace altar platform centre pyramid templo mayor side ball court area side square link shape orientation ball court north temple coatepantli serpent wall relief image skeleton snake space ball court order legend mantle power aztec city successor reputation street gold building metal stone toltec inventor science reality city period dominance sort puzzle toltec connection architecture example toltec person toltec empire evidence society sacrifice manpower resource justification expansion answer legend serpent importance stage ruler city machination texcatlipoca theory ruler struggle follower maya territory regime time hypothesi fashion find road state area villa weekend refugee capital lakeside town valle bravo pine valley town shore lake lago avandaro terracottum roof iron balcony building mas house place coterie refugee city water edge weekender relaxation boat trip sailing swimming waterskiing riding paragliding hiking golf restaurant church rise minute walk waterfront action sunset wharf embarcadero boat ride part lake road valle base monarch butterfly sanctuary area state visitor state line sanctuary area valle sauco gate road bus valle sauco tour season tourist office tourist information kiosk valle cerro butterfly sanctuary area bus valle garden suburb carnival atmosphere weekend experience city effort year canal water level place flower field sunday outing thousand mexican place feel city water commerce market colmy view boat kilometre canal woman flower fruit food cano vessel marimba player mariachi band couple number garden method lake chinampa raft reed bottom plant scene series canal land area gardening flower centre city street town garden centre flower fruit market town centre saturday food water plaza century church bernardino sunday succession person homage offering chapel plaza band mime artist crowd,6,2,3,0.12553020391379738,-0.004089285094895828,0,0
