place,country,continent,cleaned_text,count_label,tfidf_label,w2v_label,x,y,dbscan_label,h_label
Tegernsee,Deutschland,Europa,image foreigner profusion region king palace setting onion church tower meadow lake fringe forest snow peak bavarian horizon region berchtesgadener network train service town train service bus service tourist site topography character eastern south state belt upland bayerischer wald bavarian forest flank border czech republic rest tract decade sort northwest southeast iron curtain contrast west bayerischer wald valley border trade route central series city glory past city cityscape central south prince bishopric touch monument capital river isar seat dynasty capital lower year period century predecessor seat splendour statu town glory day duke seat government duchy wedding duke german daughter king celebration middle age template town festival landshuter hochzeit wedding flood location border confluence river feel size city inhabitant place fort site bishopric statu prince bishopric statu century fate prince bishopric start century mention epic poem basi heroine city uncle bishop history independence array monument wedge land blend influence city state cream colour glow fortres buzz university cruise ship quay stop feature location peninsula point place drama situation park peninsula sight century veste niederhau part fortres complex river north confluence devastation century war name appearance trading city central city today extent century street layout architecture zenith heritage city museum piece monument backdrop taste concern citizen number student visitor place stay day city roman fort part empire frontier region attack tribe legion fortres name castra regina site roman empire century inhabitant settler bishopric city heart grain district town heyday capital portion holland portion territory bluff river befreiungshalle liberation hall monument war liberation idea unity friedrich death klenze outside drum building gasometer stucco interior goddess victory name general gold staircase gallery spaciousnes hall stone staircase gallery climb view cliff stretch west town region excursion kloster river cliff abbey church work brother brewery world abbey brewery barock dunkel beer courtyard boat trip hiking trail gorge appreciation landscape weltenburger enge nature reserve route gorge north bank ferry river abbey figure salzburger territory berchtesgadener scenery south mountain mountain part feel country history bishopric salt deposit way version neighbmy way secularization region notoriety holiday home redoubt adolf eagle nest attraction summer month nationalpark paradise hiker tripper winter skiing time region beauty capital focu town markt eave chalet style architecture image look mountain view town focu visitor town reichenhall north mountain panorama nazi association spell tale settlement power regime local mountainside fiefdom nazi bigwig holiday home royalty sale mein kampf dictator guest minister neville chamberlain time crisi setting panorama picture window raid city vulnerability site attack system bunker mountainside event stand bomber complex ruin site dokumentation exhibition rise fall crime nazi movement mythology association stage exhibition section bunker complex bus terminu side park dokumentation stage ascent teahouse eagle nest condition ascent part experience road rock month tunnel bus journey pace vertigo side view tunnel lift rock teahouse ticket teahouse restaurant weather condition view summit view building glance exhibition teahouse martin bormann nazi party birthday present fund party industrialist rush enthusiasm lightning strike attack braun visit expanse water backdrop bavarian size claim lake kilometre origin remnant theti half summer magnet tourism sailing winter lake lake attraction island attempt palace setting place lakeside town rail mountain resort chiemgau south base border reason plenty option lake area tourist office information activity area ballooning lake walking paragliding rafting canyoning cycle route uferweg lakeshore shore place bathing spot bike chiemgauer radhau bahnhofsplatz fahrradhau hallwanger cycle route shore lake countryside route hiker priental hiking trail uferweg shore lake north south october hiker cyclist lake trailer bike beach pool sauna complex lakefront pool beach sept pool mountain village abbey kloster kloster form joseph schmuzer work architect enrico zuccalli church fire appearance work bit church structure century portal church interior fresco tyrolean johann jakob zeiller martin knoller church carving candle liqueur beer abbey shop valley hunting lodge father maximilian palace dollmann palace lifetime outside interior riot gold leaf crescendo king bedroom room house park fountain hmy april october folly ground maurische kiosk kiosk venu grotte cave lake stalactite stalagmite barge cupid figurehead opus stop romantic road setting river lech border town building abbey mang place district activity time year tourist spot garrison town home couple battalion army mountain troop rail connection base sight castle base hiker cyclist network walking bike trail district border vision castle crag mist tourist image fantasy setting beauty castle valley castle village hill ruin father maximilian crown prince style childhood legend swan knight fresco theme michael neher lorenz quaglio trust state part charm neighbmy life king popularity death look cousin empres dash throne dynasty family fixation loui power powerlessnes monarchy defeat impotence king fantasy world life patron richard opera king imagination composer festival theatre composer opera reactionary time romantic attention project fantasy form castle chivalry homage king villa spending bank refusal crisi fashion government throne castle berg starnberger doctor circumstance june palace place life public surprise king castle origin desire ruin style middle age architect eduard riedel dollmann drawing theatre designer christian jank work castle king castle keep plan throne room steel construction method exterior sort flight fancy scheme opera style throne room church hagium sophium grail hall year death bedroom style king poster century church altar place highlight peak king obsession singer hall floor hall scene singer contest tmy view gorge castle hyphen name skiing resort garmisch partenkirchen village stream shotgun wedding time winter olympic succes town winter city event course place winter sport resort distinction half town character charm mountain summer town setting hiker climber peak cogwheel railway bahnhof railway cable summit minute train glacier plateau peak journey summit cable summit cable station tiroler side frontier post station descent valley cable transfer cogwheel railway remainder return journey foot ammergauer alpen peak village fame thank passion play life jesu person year purpose theatre origin promise villager century play effect plague region neighbmy mountain backdrop water cow centre village lakefront complex pool sauna solarium whirlpool water slide boat landing stage minute cruise island centre lake side village cable return view lake mini golf summer toboggan romantic road highlight countryside district cleric corner church monastery respect country town abbey church appearance cloister church visitor world wieskirche meadow church hamlet town farmer wife marium lory tear eye figure christ site place pilgrimage year chapel flow pilgrim visitor number church design zimmermann exterior grace beauty interior vision rococo heaven shade ceiling fresco brother johann baptist work monastery kloster andech summer palace crystal water boat mountain backdrop lakeside village lake resort terminu rail link spot statu hotel brace hole golf course cycling mountain biking festival spring number biking trail mountain lake focu village shore pride place lakefront strandbad bathing complex beach sauna thur midnight shore abbey seat line dynasty abbey church quirinu interior fresco visit olaf gulbransson museum boat person lake cruise schifffahrt departure lake pas ridge kocheler berge difference altitude electricity visitor centre power station erlebniskraftwerk lake mountain wind spot windsurfing dinghy sailing summer mountain shore landscape north,1,5,9,0.056825166708770095,0.0015869132834844528,0,9
Koeln,Deutschland,Europa,city world inheritance history sense continuity shape cathedral building planet seat primate sense distinctivenes dialect beer name approach life museum gallery rate museum city nation television centre home broadcaster rivalry centre world gallery city century metropoli city origin emperor claudiu wife agrippina mother marriage city colonium statu name upstart twinkle founder city archbishop location century time ally world world rest city ruin year authority hometown chancellor konrad adenauer heinrich nobel prize author conscience nation scene episode kidnapping army faction industrialist hann martin height german autumn course driver bodyguard policeman tourist office slogan feeling city appeal place resident citadel francisco tenth population shape district sight course weekend stay tourist haunt river quarters local festival doubt ritual dedication frivolity street life standstill february weather season year november year event ball sitzungen session carnival speech place wednesday season climax tolle tage day thursday wednesday woman symbolism rosenmontag procession monday highpoint costume float master ceremoney farmer maiden drag aspect nazi person rosenmontag procession hour city centre sweet bouquet goody jecke fool spectator float alaaf carnival greeting dialect derivation parallel carnival event scene element name dialect accent visitor city beer litre glass day amount glas size inflation visitor beer measure brewery core eating drinking scene range dish kaviar reality blood sausage halver hahn cheese roll chicken name trotter self behavimy waiter beer culture accident pavement underfoot name block bras plaque memorial victim nazi front house victim work gunter demnig artist other czech republic place ground viertel belgisch viertel synagogue dozen front house antithesi monument name birth date fate individual case story placement stone home victim fate family individual stone opponent regime sintus roma nazi victim profile surprise silhouette metre spire history construction design cathedral transfer relic three magi work metre choir church century architect ernst friedrich zwirner size point tower waterfall sculpture tower step lift christmas market side other alter markt downside church official sort decorum mas visitor crowd geniu design height delicacy elegance structure measure building window north side nave window bible window chapel three magi ambulatory cathedral treasure shrine three magi construction reliquary altar plan drawing cathedral design tower help century builder north side ambulatory gero crucifix crucifix world predecessor addition artwork metre window artist gerhard richter transept archbishop feather home exterior cathedral side bank vault work fact century sumptuou monstrance thieve treasury series century vault artefact silver bishop crosier peter crosier century display structure shrine three magi museum level fragment city wall find century tomb,0,2,6,0.16960652614228394,-0.006785314979504848,0,16
Stuttgart,Deutschland,Europa,world town baden capital population setting palm valley vineyard multitude park presence giant time centre sight hill city hike vineyard wine bar attraction fringe rack railway tower city view side city century schlos solitude north killesberg interest weissenhofsiedlung collection building river history treatment beginning museum garden bank cannstatt town part mineral bath day birthplace museum employee company achievement brand museum north centre attraction transport system town name origin stud farm stutengarten stallion city crest trade centre seat family city control kingdom capital year future motor city town prowes world bomb town history shortage culture museum collection treasure landesmuseum engineer gottlieb employment cannstatt workshop quest combustion engine polouse workshop money counterfeiting gardener cylinder stroke repose goer grandfather clock motorbike year world motorboat carriage horse factory july going shed karl motor trail year world motor manufacturer june name daughter dealer emil jellinek landmark building bank city centre museum year motor motorbike bone shaker horse saddle cylinder motor tricycle carriage world trail blazer world production elite mark special roadster pillarbox thirty starlet racer pulse silver arrow cinema machine action pair record breaker date rudolf caracciola hmy darmstadt autobahn highway wheeler vision aeroplane engine hmy world project april week stuttgarter spring beer sausage august music stuttgarter weindorf month christmas market december town event september cannstatter volksfest equivalent army tourist valley vineyard city wine vintner number white wine wine consumption average supply demand wine valley cider tavern beer hall drinking den wine bar evening sunday place dish noodle maultaschen ravioli wine bar room person house season vintage home cooking potato soup kartoffelsuppe noodle beef stew gaisburger marsch meat feast vegetable place broom location year year guide stuttgarter weine tourist office place information stuttgarter weinwanderweg hiking route vineyard wine initiative stuttgarter weindorf weekend august wine buff hundred tipple year vintage sale chance wine event fellbacher herbst weekend october cannstatt kachelofen eberhardstr bastion beam tablecloth bar han gluck food course meal thur noon midnight marktstr cannstatt special sausage salad maultaschen main interior building film flat midnight midnight schnellenturm weberstr sauerbraten sauce duke christopher defence tower nest quality price fare main midnight stetter rosenstr wine connoisseur heaven count wine list bohnenviertel snobbery family place local news bean soup beef goulash lentil soup sausage,0,2,0,-0.04686680690322397,-0.003996736841056441,0,3
Wartburg Castle ,Deutschland,Europa,castle palace stuff fairytale spire facade interior marble rococo flourish ceiling fresco extravagance world heritage palace castle moment staircase balthasar rocaille stucco marble effect clemen august residence staircase exuberance design pity palace wheel reception room staircase vein garden parterre fountain equivalent exces dominique girard design avenue park hunting lodge edge forest scale lodge spirit clemen august hunting falconry pastime summer visit concert palace experience palace florian trykowskiin palace park ensemble world heritage site list heritage humanity area garden peacock island world architecture landscape design prussian acadium core frederick great park treasure capital december month reunification world heritage committee area complex palace park world heritage list zone network border fortification sponsorship stiftung brandenburg park walkway result ensemble grandeur hectare world heritage site park orangery palace jen wegenerperched plateau castle year legend ludwig springer century castle decay restoration programme reputation castle legend courtesy artist century reverence thing theme troubadour place work richard wagner opus saint king daughter wife landgrave ludwig life legend miracle rose bread meat coat husband food rose castle connection martin pope secret translation testament hall century column banner student part tercentenary visit stay martin cell summer music festival month concert surrounding castle christof herdtthe residence balthasar palace statu symbol super league johann philipp franz prince bishop residence city order centre thing palace palace master builder palace staircase rococo stairwell bay vault staircase series landing wall stucco setting ceiling fresco artist giambattistum painting world title continent court centre art fresco staircase bombing white weisser saal stucco work materno bossi comparison imperial marble column dome fresco position holy roman empire setting music concert tmy interior time iron gate group figure palace garden francesco carovillanotop image hunting lodge florian trykowski,0,2,2,0.27106268855995114,-0.0025880848892143116,0,10
Schwarzwald,Deutschland,Europa,setting brother fairy tale black forest image land cuckoo clock cherry garb farmhouse hill hill forest exploration character region part state history borderland evidence time series granite summit counterpart side valley border region roman region century part black forest prominence timber forestry woodwork farmer winter cuckoo clock industry precision engineering manufacture instrument job mainstay tourism year thank skiing facility region crowd hotspot foot bike fame black forest region day course chance gear region scenery time tradition spa baden baden palm hill century tropez society privilege elegance villa hotel boutique garden socialite absence sight setting weekend margrave today bath spring bather emperor caracalla millennium bath century architect friedrich weinbrenner quarter year impresario jacque casino playground joint queen kaiser wilhelm visitor bill clinton barack obama beckham mark twain feeling town sham fraud snobbery town world halcyon day pampering highlight year august race event week grosse woche week august country elite nine hat valley black forest landscape birthplace folk costume cuckoo clock tonne region valley horseshoe black forest valley system series town monastery brewery town gathering house generation valley money logging farming community heritage museum freilichtmuseum region sight valley river stream valley bollenhut pompom folk costume woman tourist literature region head valley black forest town cuckoo clock shop coach party time piece case clock museum confluence freilichtmuseum museum farm vogtsbauernhof roof building style sort place jerome jerome charm black forest house sociability cow room horse goose duck kitchen pig child chicken place building complex sawmill granary bakery distillery smithy chapel village effort guide craft demonstration place appeal valley valley point level town health resort today town thing cuckoo clock thousand sale tourist traffic industry kitsch market clock road town focu pilgrimage church baroque town bend road clock shop attraction cuckoo clock town attraction plenty town village northern black forest interest wildbad town region drife badische weinstrasse strip vineyard valley home europa park amusement park valley drive drive black forest border europa park theme park fire pleaser ride area size football pitch number village country village driver badische weinstrasse badische wine road route foothill black forest vineyard castle alternative motorway corridor valley south traveller time hand interest wine town badische weinstrasse vineyard schlos staufenberg stop interest wine lover durbacher winzergenossenschaft wine noon shop selection wine sample road centre route heart black forest black forest highway combination pine meadow valley peak route drive time journey park viewpoint belvedere route view upper valley time couple hike loop hike allerheiligen monastery south ruin abbey sign path waterfall minute walk southern black forest series mountain peak resort peak area settlement slope valley bottom hill lakeside resort town resort blasien exception east area fringe black forest gorge hiking west land border town draw cluster vineyard hill mountain horizon black forest summit peak bulk dome area nature reserve flower fauna mountain hen goat chamoi presence black forest farmhouse charm village area downhill skiing centre slope side village group roadside house pas lack service nightlife village valley summer focu hau natur visitor centre display history start point hike steig loop hut reach ground vista black forest hike winter portion trail skiing route walk hau natur winter part network lift pas summer chance view legwork fringe black forest view landscape farm pasture gorge water chasm stretch cliff water forest hike walk bus hiker gorge route rate community gateway valley railway network north ride south taster canyon landscape valley hmy trip walk watermill wutach valley place hike stretch hour gorge start mountain town activity winter gateway network lift lift toboggan winter trickle visitor summer thank presence roller coaster bobsleigh track couple mountain bike trail rider equipment base station shop skiing draw waterfall rock side valley town trail church centre trail park hairpin route fall winter effect trail origin cuckoo clock description century year cuckoo clock black forest site workshop quality craftsmanship engineering imagination market cuckoo clock shop array shop assistant design chalet hunting theme cuckoo technology clock pine cone winding cone attention labmy saving hand thank revolution craft model quartz recording cuckoo hmy other light bird sleep price size clock clock talking piece creation thousand choice competition shop shipping service deutsch uhrenmuseum shop uhren park schonachbach road cuckoo clock world claimant side town easter easter image black forest funny solution studio shutterstock,0,1,7,-0.10104928499700973,0.004050522517265239,0,4
Bodensee,Deutschland,Europa,body water climate lake constance country border backdrop town lake north shore island town transport lakeside settlement city shore place lake base ferry service lake island weather region activity hiking cycling trail lakeside town vineyard orchard beach watersport visitor water summer respite humidity summer holiday season popularity road hotel time fruit tree autumn time wine harvest lake point promenade town feel seaside resort place life lake town smithereen world thank aviation industry setting world event count ferdinand cigar airship july lake decade distance travel airship flight york week janeiro day cloud time reformer name abus hussite movement protestantism century writing englishman john wycliffe church reform sale indulgence following number invitation council position promise passage event councillor protection trial stake heresy sort figurehead czech martin luther german border side lake university town origin town city fame council great schism catholic church restructuring pope sightseeing base trip island population student town restaurant bar scene region town festival august lake firework bonanza century count ferdinand maverick walru moustache honour attention wealth airship enthusiasm jubilation world bomber scout pride fleet graf day hour minute year globe day time airship time day service york passenger reichsmark return ticket month wage time flight ocean graf day sister ship hindenburg fireball jersey passenger crew analysi spark mooring line varnish linen skin blaze airship hydrogen tank airship helium permission fuel disaster progress aviation industry favmy time deal research development airship helium deutsch reederei ship tenth size original passenger jaunt,0,5,1,-0.1714376392068119,0.0023693838210485686,0,2
Vatican,Italien,Europa,bank city centre city state territory wall side side door rest city pilgrim form peter piazza city state inhabitant radio station newspaper service security service swiss guard peter cemetery hill rise building basilica name siting headquarters catholic church peter renaissance palace home museum museum complex world basilica pietro peter shrine catholic church site peter tomb architect century security queue mind dres code knee shoulder rule basilica thing right attack vandal glas life rest building church dome site peter tomb diameter dome pier relief basilica relic veronica handkerchief face christ lance longinu christ side piece true cros side nave bronze statue peter monument basilica foot attention pilgrim bronze material baldacchino tonne metal roof sculpting apse bronze chair peter monument alexander transept skeleton marble drape pope prayer entrance aisle monument piu treasury rich century bronze tomb pope sixtu step statue longinu grotto footprint church majority pope john paul ascent roof dome entrance right basilica complex view gallery interior dome sense size church ascent lantern dome view city image piazza pietro city banauke shutterstock,0,2,2,0.284131259735704,-0.005996112211622534,0,10
Capri ,Italien,Europa,peninsula island part naple time augustu island cliff scenery care office tiberiu capital antic death roman century discovery blue grotto island landscape rise tourism english lawrence george bernard shaw visitor graham greene gracie field house time failure uprising pres day consensu place crowd price degree july august summer weekend mis island charm place view walk piazza della vittorium gauntlet souvenir stall axel villa michele house garden highlight island century writer physician elite number year place furniture knick knack artefact column villa site history exhibition garden flora fauna image faraglioni rock giardini augusto natalium macheda shutterstock,0,0,1,-0.1685264667444844,-0.003702071547235434,0,2
