place,country,continent,cleaned_text,count_label,tfidf_label,w2v_label,x,y,dbscan_label,h_label
Waterton Lakes National Park,Canada,America,location canadian park waterton lake national park map extension glacier national park border size park trail canadian park settlement hike walk lake valley hike tamarack trail ridge backcountry option plenty hiking drife acces road akamina parkway rock parkway interior viewpoint spot boat national park pas lake park tandem glacier national park entry fee year region hunting ground people ktunaxa kootenay mountain bison prairie grassland blackfoot people sphere influence ktunaxa century region area resident john george globule cameron creek river discovery entrepreneur region zeal industry river settlement rocky mountain development company well monument akamina parkway location great northern railway link railway tourist number prince wale hotel world heritage site john george kootenai character wild west fantasy time army francisco gold field pony expres rider army region blackfoot native arrow back hand chief sitting bull stake dead night ktunaxa year retreat marriage influence cabin region lake reserve warden area dominion park year park superintendent year park border grave road village history landscape park rock mountain formation mas lewi thrust monolith front result rock year basement year shale zone transition park place peak landscape upside mountain effect peak north mountain summit shape sawtooth ridge national park variety altitude habitat climate park plant wildlife prairie habitat species region result diversity flora fauna park plant species species bird park north prairie grassland home grass grama fescue rose emblem sagebrush buckbrush rose pincushion cactu park wetland lake left blakison valley belly river campground aspen parkland zone prairie forest habitat forest zone plant animal life slope cameron lake copsis year tree park forest growth spread bear gras flower gras metre height tree zone lake example bird lower lake linnet lake cameron lake wishbone trail chief mountain time season september november osprey village lake place hope mink muskrat beaver belly river park bear slope blakison valley july august berry readines hibernation grizzly moose cougar deer rock canyon parkway mule deer village mountain goat ground lake bighorn sheep visitor centre flank blakison valley,0,1,7,-0.10605240150461838,0.010723655262742413,0,4
Iles-de-la-Madeleine,Canada,America,part province northern farmland south tundra north kilometre nature area influence winter summer frost moose caribou wolverine bear forest place human inroad civilization shore lawrence river highway city dropdown content capital highlight region narrowing lawrence river gateway north city name word river point north south shore river city waterway connection shore ferry city shore lawrence route shoreline highlight saint laurent lower lawrence region land farming forestry hill landscape field remnant system stop trip peninsula woodcarving centre saint jean port joli saint roch aulnaie centre loup landscape parc north shore lawrence river city coast fjord region jesuit historian xavier world biosphere reserve species caribou wolf latitude area rest portion canadian shield plant hill cliff valley river brook waterfall landscape artist clarence gagnon marc fortin jean paul lemieux inspiration tourist destination year person city weekend break land village church countryside highway route city baie sainte catherine town highway bus city village baie saint paul transport bike expense wall fjord depth place height cliff waterline half parc part saint laurent bridge shore archipelago madeleine magdalen island middle gulf lawrence hmy peninsula prince edward island island sand spit gravel road boat dozen island crescent series dune lagoon outcrop village ferry port middle meule island gulf stream winter mainland wind sandstone cliff part shoreline array arch cave tunnel rock formation archipelago attraction meule havre maison island inhabitant settler fishing lobster catch pressure seal hunt winter islander seal flo march sector fishery fish stock depletion island livelihood tourism resident life ecology island visitor archipelago landscape sense isolation dune beach island attraction adventure traveller wind august october condition windsurfing kitesurfing canadian professional amateur windsurf championship year island current weather condition swimming water home jellyfish opportunity water island wreck diving horseriding beach time focu trip boat fishing tripswindsurfing kitesurfing kayakingdivinghorseridingin meule vent chemin john aucoin horseback ride beach pony ride camp boat tripsdown wharf lagune june sept tmy lagoon glas bottom boat excursion island life lobster fishing saint jean river area canadian shield beach terrain century area lakeshore village route saint sight jalbert ghost town shoreline parc pointe taillon bleuet lake town option cyclist bike train tmy lake cuisine meat blueberry itinerary lake highway sainte anne town acces mont sainte anne resort season destination venue mountain bike world circuit summer mountain bike trail base area trial skill north shore style obstacle gondola trip mountain bike course world route mountain bike base area suspension model hour suspension view lawrence river city trail gondola mountain hiking trail park base area hill bridge chute jean larouse minute walk trail series waterfall latticework stairway waterfront bord roof lawn landmark focu quarter road church chapelle june donation visit season reservation waterfront harbmy centre marin group research education marine mammal whale watching documentary film display life cycle whale effort number whale watching trip community october price trip boat zodiac ride price starting point excursion bergeronne escoumin time water point departure whale amount contact time money reservation ferry queue quay baie sainte catherine company boat shore mouth whale firm cruise fjord whale fjord package brochure tourist office offer company tour year boat beluga whale craft hike pointe marina lookout point beluga spotting chance sighting lookout point shore baie sainte marguerite bergeronne array interpretation centre whale watching adventure centre marin gulf lawrence north west baie chaleur south east peninsula chain mountain highland interior shore opportunity community existence sea soil landscape scenery hill ravine vista mountain coastline lawrence river drive summer holiday spot week july construction holiday period accommodation activity advance spot navigator explorer jacque july trip lawrence river day time cros escutcheon franci king christianity claim territory route ambition land people gatherer metal loot spaniard aztec intention trip contact iroquoi spring trust chief son franci trip iroquoi colony reputation cargo gold diamond iron pyrite quartz crystal opportunity skiing climbing city skiing snowboarding resort mont sainte anne massif expert search bowl powder terrain mogul field glade terrain park night skiing image frontenac castle quebec city shutterstock,0,0,9,0.05329658742225215,0.004412286992458967,0,9
Lake Louise,Canada,America,national park centre lake louise town resort mall shop hotel lake louise village second lake village lake louise drive self crowd monster hotel sight area moraine lake village scenery hiking country area summer winter thing plenty skiing resort winter sport hundred kilometre skiing trail winter activity lake louise area trail continent plu person summer trail hiker reader couple teahouse mountain chalet snack visitor centre lake louise restriction bear activity group person group trailhead number problem stroll lake louise moraine lake hike choice lake agne plain glacier loop lake louise larch valley sentinel pas hike moraine lake lake agne trail path shore lake hotel climb view teahouse mountain lake agne hour walk thing teahouse side lake head pas stroll left beehive eyrie teahouse trail teahouse little beehive mite panorama sweep valley walker pas beehive trail trail scenery teahouse plain glacier glacier trail lake agne beehive section hotel lakeshore point teahouse ascent option lake agne beehive route plain glacier trail return lake louise loop downhill stroll finale shore lake louise appeal trail acces viewpoint mountain hour ascent trail summit push view wall mount temple mountaineer walter wilcox paradise valley name valley beauty meadow forest moraine lake moraine lake road junction lake louise drive walk hike side valley loop gain lake annette view mount temple north face horseshoe meadow backcountry campground head valley trailhead climb rock sentinel pas side valley moraine lake trail skoki valley region lake louise hike tent backcountry campground trailhead gravel road lake louise area person boulder pas trek ascent trailhead trip skoki lodge trail backcountry campground leaflet visitor centre moraine lake area walk amble shore stroll consolation lake hmy trip respite frenzy moraine lake walk view mountain lake name explorer reward consolation desolation valley pick panorama ridge trail trail taylor lake radium castle junction hike larch valley sentinel pas trail lake shore lodge hour return trip climb forest track view lake tree trail junction ascent hiker eiffel lake track larch valley upland stand larch view peak energy sentinel pas hour walk moraine lake trail pas view vantage point meadow vista paradise valley crest pas paradise valley scree descent walk lake louise village trail moraine lake road moraine lake option moraine lake eiffel lake wenkchemna pas trail climb lake larch valley path junction scenery grandeur head valley peak eiffel lake hike climb moraine lake rock pile clump tree lake walk track terrain wenkchemna pas view valley peak park,9,5,7,-0.1260900687082229,0.02424920005545426,0,4
Long Beach,Canada,America,national parkreserve amalgam mountain rainforest beach landscape town north port renfrew south area long beach broken group island hundred islet sailor kayaker west coast trail distance hike area magnet surfing whale watching france barkley port alberni shuttle bus bus port alberni combination itinerary region long beach fishing village tourism charm position accommodation base exploration southeast tour park visitor park port alberni part long beach length stretch road port alberni park visitor centre driving drop junction east west national park visitor information centre community amount demand accommodation road trailhead west coast trail weather part island summer soaking season average rain motto part world thing weather clothe boot rain coat time breaker backcountry season storm watching pastime rate accommodation park component long beach tract sand point schooner west half moon east snow peak mackenzie range backdrop beach canopy rainforest sand sort seascape world driftwood surf crag islet rock pool life long beach beach beach side merit beach area time national park visitor centre long beach wildlife coastline species area world stuff pool starfish anemone snail sponge mammal whale lion addition thousand bird pintail mallard brant goose weather lot beachcomber glas fishing float clam digger angler surfer canoeist windsurfer diver water suit current lump driftwood wave swimming temptation shell souvenir park regulation park long beach stretch coastline consumption manner taste area beach shoreline plenty cove hiking trail weather tide long beach trail road beach road trail course drive road path guide visitor centre trail specific willowbra halfmoon trail half moon florencium safety south beach forest cove south beach rock chah nulth south beach trail shorepine wheelchair boardwalk trail vegetation tree metre hundred year rainforest loop boardwalk comber beach walk sand schooner cove lead tranch rainforest beach schooner radar hill viewpoint mountain view north america walk west coast trail scenery port renfrew stroll experience walk equipment degree fitnes number person stage trip day trip food rain stretch forest isolation mariner area coastline graveyard valencium hand crew government trail sailor chance safety coast path telegraph route town lighthouse linesman lighthouse keeper disrepair backpacker trail land first nation ditidaht first nation country trail section pacheedaht first nation land port renfrew weather factor trip trail september july august month period warden local hand river route effect tourist influx local development minimum interest waterfront charm visitor place season place frenzy summer spit fishing village view restaurant scene notch accommodation variety boat seaplane tour whale watching surfing surf hand fishing angle mean island spring whale centre campbell home artefact seafaring first nation culture spot eagle aerie gallery campbell gallery longhouse style building cedar interior beach town mackenzie beach chestermano beach acces lynn dolphin motel beach visitor centre direction plenty whale operator town season march excursion sort boat inflatable hull cruiser whale watching national park tour meare island spring cove chance whale route operator whale watching excursion hmy trip hull operator west coast aquatic safari fourth whale watching tour fishing outing family novice trip spring cove addition tour company bear watching kayaking hiking fishing charter tour hike nature ramble forest seashore company visitor centre detail surfing capital thank wave surf sister campbell company instructor novice foot wave lesson wetsuit board port alberni junction person sheltered word ucluth wind chah nulth century arrival white world fishing ground today port volume fish trade town appearance fringe base angler whale watcher watersport enthusiast visitor long beach north trail terrace beach town peninsula road lighthouse hike wild trail halfmoon florencium long beach park trail coast guard drive amphitrite point lighthouse view storm watching park boardwalk section loop national park world area whale watching thank location migration route food water bay boat head trip duration boat trip chance whale coast tail during fluking animal time,0,9,1,-0.20531753689696,0.007977061530920102,0,1
Cotahuasi Canyon,Peru,America,expedition zona reserva nacional cotahuasi canyon visit rafting trip place trip valley volcano world canyon grand canyon south road route part canyon settlement settlemenet street century church climate name adventure travel destination facility village spring road right part canyon village valley plateau canyon raymondi cactus fork pueblo local blanket pueblo trail waterfall side valley rock formation bosque piedra spring leg hike ruin side river hmy city,0,8,8,-0.355525192875564,0.005814746240157658,-1,13
Paracas National Reserve,Peru,America,place resort baneario chaco spot resort hotel bungalow beach entrance reserve hostel restaurant scene sand reserve place tent wharf pelican place speedboat island trident wildlife interest ballesta island national reserve kilometre wildlife hectare pampa wind sandstorm sand world sea couple hectare ocean reserve border abundance plankton nourishment array fish species octopu squid whale shark dolphin bas plaice marlin desert staging point host bird sanctuary species school dolphin wave condor peninsula food desert fox beach bird lion lizard sand person predecessor culture year peak reserve road fish meal factory concern spillage fish bird mammal life entrance reserve obelisk century sailing boat landing september mission stranglehold cycling reserve facility bike track tyre mark surface desert,0,9,3,0.11197962042638208,0.0011822968262526132,0,0
Choquequirao,Peru,America,alternative inca trail hike trekking tmy day demand tourist season machu picchu inca citadel name cradle gold terrace peak range remain century vegetation visit hiram machu picchu site apurimac river level district retreat inca emperor centre century role person produce rainforest community ashaninka apurimac river town village inca coca macaw feather manioc salt ashaninka product hiram search inca city stonework complex terracing archeologist citadel evidence dig population settlement conquest route road hour hour trekking remain citadel route hike pumasillo range mina victorium route hour panorama valley trail playa rosalina bank night walking hour sector site centre system aqueduct canal spring building courtyard plaza inca terracing day alternative route path ruin river bridge ignacio hmy hike valley villa loro lodge town colectivo hour walk taxi lodge phone route route,0,6,0,-0.02722500098065497,0.007256583424702142,0,3
Huacachina,Peru,America,myth lagoon princes clothe mirror hunter mirror lagoon lagoon resort palm tree sand dune water power world atmosphere lagoon source water well syrup lagoon mystique spot power lagoon person lake arthritis rheumatism sand lagoon person problem local neck dune settlement house lagoon construction dune lake view morning dune buggy run side lake library biblioteca abraham valdelomar focu,0,5,3,0.08277598638206506,0.005529623883745516,0,8
Plaza de Armas,Peru,America,centre plaza arma location huacapatum inca plaza place bearing ruin plaza fortres night figure christ horizon plaza side shop restaurant plaza edge iglesium jesu pair belfry foundation inca viracocha palace line fortres comparison form construction cathedral shape cros nave pillar entrance cathedral door triunfo chapel church granite altar canva earthquake cathedral pulpit cedar wood seat altar silver painting school cathedral appeal folklore legend sight myth chief hand tower glory inca empire building gold bronze bell angola slave girl church bell world cathedral door craftsman adornment puma head motif god,0,6,2,0.3264067769187241,-0.005298062968435223,0,7
Pisac,Peru,America,inca road canyon sacred valley citadel entrance gorge route inca empire border jungle hmy town look citadel morning market place time week addition fiestum virgen carman july alternative festival name fiestum virgen carman procession music dance group firecracker celebration food stall plaza market town square hand bead bargain market number shop calle bolognesi walter sacred valley road river bridge plaza,0,6,1,-0.21460280072228916,-0.0002403247698714366,0,1
Chachapoyas and around,Peru,America,town springboard wealth remain opening road network part market town range fruit veggies craft good accessory strap belt population reputation person ruin city city capital person west pueblo muerto cliff face burial centre elite culture remain citadel complex extent culture community jalca land region ravine valley land guide bear puma deer hummingbird highland plain town catarata goctum cloud person description tribe region city utcubamba valley tributary peak ridge inhabitant hair face person fortification empire inca possession gold silver mine soil decline attraction traveller region ruin site road ruin village utcubamba valley flash flood home village point acces ruin village nuevo valley fortres city form entry passageway site inca ditch stand conquistador foot building material time volume great pyramid egypt person height farmer builder artisan stone house site wall limestone slab pattern section granite block layer wall thicknes stone ruin remain stone house pattern ceramic local animal head condor design deer symbol serpent figure style kogi village today connection kogi people link influence building inca occupation structure area kitchen hearth pestle part site rank society building wall temple function site extent tree epiphyte cloud forest enclosure watchtower vegetation shrub tree tower cone bottle cavity tintero well place sacrifice archeologist bone inhabitant citadel,0,6,0,-0.03023955840381295,-0.002353588256589665,0,3
Chiclayo,Peru,America,centre bank heritage attraction city sprawl city feel person traffic daylight hour tourist attention street central market daily market lane part ferium baltum focu activity town mercado modelo part central market food vendor centre stall outside market north revelation country section animal cub canary condor chick fish speciality pescado seco display herbalist shop witch market herb charm whale bone cactus mercado mochoqueque daily edge town market window life part world tuesday friday pickpocket,0,8,1,-0.20923175324920842,-0.006993289816806198,0,1
Piura,Peru,America,city rest country south sechura desert east mountain francisco day route meeting inca overlord city miguel inhabitant woman trade cotton today nation cotton city oasi atmosphere vagary time loco crazy river level riverbed action sight bank temperature january march region straw sombrero mayor goat herder plenty opportunity semana week town spirit,0,6,0,-0.023336840606394786,-0.0014762514207415298,0,3
Pucallpa,Peru,America,city inhabitant interest traveller lago yarinacocha while feel optimism jungle frontier city festival visitor semana region ucayali week september forest produce market folklore music dance hmy town downtown food market independencium market mayo latter stall jungle produce port hoyada puerto italium activity craft shopping mariscal block block tanca block,0,2,3,0.12096044941138845,-0.004838408744140197,0,0
